rating,category,reviews,description,ingredients,id,url,title
0.00,chinese,0,Ginger milk curd is a quick and easy dessert that is popular in China. Ginger juice helps the milk set to form a solid dessert. This recipe is for one portion but it is easily scaled up.,"[""1 cup whole milk"",""1 tablespoon white sugar"",""2 slices fresh ginger, minced""]",258155,https://www.allrecipes.com/recipe/258155/ginger-milk-curd/,Ginger Milk Curd Recipe - Allrecipes.com
4.00,chinese,1,"Sometimes called 'potstickers,' these lovely little dumplings are pan-fried and then simmered. Serve with your favorite Chinese dipping sauce or just soy sauce.","[""1 1/4 cups boiling water"",""1 pinch ground black pepper"",""1 pinch salt"",""1 tablespoon vegetable oil"",""1 tablespoon vegetable oil, or as needed"",""1/2 teaspoon salt"",""1/4 cup rice vermicelli"",""1/4 teaspoon sesame oil"",""2 bunches Chinese chives, finely chopped"",""2 mushrooms, finely chopped"",""2 tablespoons small dried prawns"",""3 eggs"",""40 round wonton wrappers""]",258153,https://www.allrecipes.com/recipe/258153/pan-fried-chinese-dumplings/,Pan-Fried Chinese Dumplings Recipe - Allrecipes.com
4.36,chinese,211,"This traditional recipe is from the area of Northern China. Wonton wrappers are stuffed with finely chopped vegetables and pork, then fried and served with a spicy dipping sauce.","[""1 (14 ounce) package wonton wrappers"",""1 green onion, finely chopped"",""1 tablespoon chili oil"",""1 tablespoon soy sauce"",""1 teaspoon rice vinegar"",""1 teaspoon salt"",""1 teaspoon sesame oil"",""1/2 medium head cabbage, finely chopped"",""1/2 pound ground pork"",""1/2 teaspoon white sugar"",""2 slices fresh ginger root, finely chopped"",""2 water chestnuts, drained and finely chopped"",""3/4 cup water"",""5 tablespoons vegetable oil""]",22460,https://www.allrecipes.com/recipe/22460/pot-stickers-traditional/,Pot Stickers Traditional Recipe - Allrecipes.com
4.60,chinese,2,Delicious!,"[""1 jalapeno pepper, cut into 8 thin slices"",""1 large clove garlic, minced"",""1/4 cup chopped fresh cilantro"",""2 ounces uncooked bean threads (cellophane noodles)"",""2 skinless, boneless chicken breast halves, cut into 1/2-inch strips"",""2 tablespoons fish sauce"",""2 tablespoons lime juice"",""2 tablespoons thin strips fresh ginger root"",""3 (14.5 ounce) cans chicken broth"",""4 2-inch pieces fresh lemongrass, minced"",""6 large shrimp, peeled and deveined""]",219780,https://www.allrecipes.com/recipe/219780/chinese-glass-noodle-soup/,Chinese Glass Noodle Soup Recipe - Allrecipes.com
4.00,chinese,12,"Wonton Noodle soup is a traditional Cantonese meal served as a hearty breakfast or lunch.  These wontons, made from seasoned pork and shrimp, are the actual dumplings served with egg noodles and chicken broth. 'Dashi' - or fish flakes - is an optional ingredient, but adds wonderful flavor. If you feel daring, you may try making your own dashi from a fish purchased whole.","[""1 1/2 teaspoons salt"",""1 egg"",""1 pound lean ground pork"",""1 pound medium shrimp - peeled, deveined, and coarsely chopped"",""2 (14 ounce) packages square wonton wrappers"",""2 tablespoons soy sauce"",""3 green onions, finely chopped"",""3 tablespoons dashi (dried fish flakes) (optional)"",""5 dried black or shiitake mushrooms, reconstituted in hot water and chopped""]",64834,https://www.allrecipes.com/recipe/64834/wontons-for-wonton-noodle-soup/,Wontons for Wonton Noodle Soup Recipe - Allrecipes.com
4.56,chinese,25,"After several experiments, I created this cross between a bread and pastry dough that works perfectly for making filled buns. I generally fill with a BBQ filling, but you can be creative.","[""1 cup warm milk (110 degrees F/45 degrees C)"",""1 tablespoon active dry yeast"",""1 teaspoon sesame seeds for garnish (divided) (optional)"",""1/2 cup white sugar"",""2 eggs, beaten (divided)"",""2 teaspoons salt"",""2 teaspoons water"",""4 cups bread flour"",""6 tablespoons vegetable oil""]",133909,https://www.allrecipes.com/recipe/133909/chinese-sweet-bun-dough/,Chinese Sweet Bun Dough Recipe - Allrecipes.com
4.05,chinese,16,"For people who don't want tons of sugar in their rubs, it's a nice change to provide lighter ribs.  When I don't have spare ribs, I have pork chops.","[""1 (1 inch) piece fresh ginger root, sliced"",""1 1/2 tablespoons soy sauce"",""1 pound pork spareribs, cut into 3 inch pieces"",""1 tablespoon vegetable oil"",""1 teaspoon rice wine"",""1 teaspoon white sugar"",""1/2 teaspoon ground cinnamon"",""1/4 teaspoon pepper"",""1/4 teaspoon salt"",""2 cups water"",""5 green onions cut into 2-inch pieces""]",64450,https://www.allrecipes.com/recipe/64450/chinese-braised-spare-ribs/,Chinese Braised Spare Ribs Recipe - Allrecipes.com
4.50,chinese,2,A potsticker recipe direct from a Taiwanese friend.,"[""1 (2 inch) piece ginger root, peeled and minced"",""1 bunch cilantro, chopped"",""1 tablespoon sesame oil"",""2 egg whites"",""2 heads napa cabbage, finely chopped"",""2 pounds ground pork"",""3 (16 ounce) packages potsticker wrappers, or more as needed"",""3 jalapeno peppers, minced"",""salt and ground black pepper to taste""]",257372,https://www.allrecipes.com/recipe/257372/taiwanese-dumplings/,Taiwanese Dumplings Recipe - Allrecipes.com
4.50,chinese,11,"This is an authentic familiar traditional Cantonese home-style dish.  It's a recipe mostly passed on within families, and it is rare to find this dish in any Asian restaurant.  Trust me though, it is VERY good.  It's actually intentionally salty tasting, so it goes very well with white rice. Salty eggs are also called a Haam Daan- you can find them at all Asian supermarkets.","[""1 1/2 pounds ground pork"",""1 egg"",""1 salted (hard-cooked) duck egg, shelled"",""1 tablespoon milk"",""1 tablespoon soy sauce"",""1 teaspoon ground black pepper"",""1/2 head broccoli, cut into florets"",""1/2 teaspoon white sugar"",""1/4 teaspoon salt""]",99381,https://www.allrecipes.com/recipe/99381/ground-pork-cake-with-salty-egg-haam-daan-ju-yoke-beng/,Ground Pork Cake with Salty Egg (Haam Daan Ju Yoke Beng) Recipe - Allrecipes.com
0.00,chinese,0,"A traditional Chinese way to prepare fish, this meal is simple and flavorful, and is one of my favorite childhood dishes. Serve with rice.","[""1 (3 inch) piece ginger, peeled and cut into matchsticks"",""1 1/2 pounds black cod (sablefish) fillets, cut into large pieces"",""1 tablespoon light olive oil"",""2 green onions, cut into 1-inch pieces, or more to taste"",""2 tablespoons sesame oil"",""3 tablespoons soy sauce, or more to taste"",""3/4 cup water""]",269766,https://www.allrecipes.com/recipe/269766/chinese-poached-black-cod/,Chinese Poached Black Cod Recipe - Allrecipes.com
4.56,chinese,26,"My sister-in law is Chinese and this is one of her most delicious Dim Sum recipes. It's Chinese name is Char Siu Bao, takes a little effort but is extremely worth it. Barbequed pork can be found in Asian markets, or often in the supermarket deli section.","[""1 (.25 ounce) envelope active dry yeast"",""1 clove garlic, minced"",""1 cup lukewarm water"",""1 green onion, thinly sliced"",""1 tablespoon cornstarch"",""1 tablespoon white sugar"",""1/2 cup boiling water"",""1/2 pound Asian barbequed pork, cubed"",""1/4 cup white sugar"",""2 tablespoons light soy sauce"",""2 tablespoons oyster sauce"",""2 tablespoons sesame oil"",""2 tablespoons shortening or vegetable oil"",""2 tablespoons vegetable oil"",""2 tablespoons water"",""4 1/2 cups all-purpose flour""]",70830,https://www.allrecipes.com/recipe/70830/chinese-steamed-buns-with-barbecued-pork-filling/,Chinese Steamed Buns with Barbecued Pork Filling Recipe - Allrecipes.com
4.31,chinese,894,Stir-fried beef in a light gingery sauce. Serve over steamed rice or hot egg noodles.,"[""1 pound beef round steak, cut into thin strips"",""1 tablespoon brown sugar"",""1 tablespoon minced fresh ginger root"",""1 tablespoon minced garlic"",""1 tablespoon vegetable oil"",""1/2 teaspoon cornstarch"",""2 tablespoons rice wine"",""3 tablespoons soy sauce"",""8 ounces snow peas""]",15679,https://www.allrecipes.com/recipe/15679/asian-beef-with-snow-peas/,Asian Beef with Snow Peas Recipe - Allrecipes.com
3.00,chinese,2,"This is a recipe I came up with after searching through many different versions. It's light and fluffy, yet still traditional, representing prosperity during the New Year.","[""1 1/2 cups cake flour"",""1 egg"",""1/2 cup cornmeal"",""1/2 cup milk"",""1/2 cup warm water"",""1/2 teaspoon salt"",""1/3 cup melted butter"",""1/3 cup superfine sugar"",""1/4 cup raisins (optional)"",""1/4 teaspoon vanilla extract"",""2 teaspoons active dry yeast""]",132659,https://www.allrecipes.com/recipe/132659/traditional-chinese-steamed-cake-fa-gao/,Traditional Chinese Steamed Cake (Fa Gao) Recipe - Allrecipes.com
0.00,chinese,0,"This is a Chinese dessert of steamed milk, very simple to make. It is smooth and creamy and perfect for a sweet tooth. Serve warm or cold.","[""2 egg whites"",""3 cups whole milk"",""3 tablespoons white sugar""]",258156,https://www.allrecipes.com/recipe/258156/double-skinned-milk/,Double Skinned Milk Recipe - Allrecipes.com
4.00,chinese,2,Bamboo shoots pepped up with pork and spices.,"[""1 (14 ounce) can thinly sliced bamboo shoots"",""1 fresh red chile pepper, seeded and minced"",""1 tablespoon peanut oil"",""1 teaspoon Shaoxing rice wine"",""1 teaspoon sesame oil"",""1/2 teaspoon crushed red pepper flakes"",""2 cloves garlic, minced"",""2 tablespoons peanut oil"",""2 teaspoons rice vinegar"",""2 teaspoons soy sauce"",""3 green onions, thinly sliced"",""3 ounces ground pork"",""3 tablespoons chicken broth"",""salt to taste""]",157593,https://www.allrecipes.com/recipe/157593/pork-and-bamboo-shoots/,Pork and Bamboo Shoots Recipe - Allrecipes.com
5.00,chinese,1,"A simple and elegant Chinese prawn dish, which is quick and easy to make. Prawns are cooked in a gingery soy sauce. Serve with freshly cooked rice.","[""1 (4 inch) piece fresh ginger, finely chopped"",""1 3/4 pounds shell-on prawns, deveined and patted dry"",""1 tablespoon rice wine"",""1 teaspoon chicken bouillon granules, or to taste"",""1/4 cup finely chopped spring onions"",""1/4 teaspoon salt"",""2 tablespoons chicken stock"",""2 tablespoons white sugar"",""2 teaspoons soy sauce"",""7 tablespoons vegetable oil""]",258675,https://www.allrecipes.com/recipe/258675/fried-prawns-in-soy-sauce/,Fried Prawns in Soy Sauce Recipe - Allrecipes.com
4.00,chinese,7,"Tomato and egg served over rice is a Chinese staple. You can easily omit the pork to make this vegetarian.  This recipe is from my mom, who grew up in Guangzhou.","[""1 tablespoon brandy"",""1 tablespoon cornstarch"",""1 teaspoon white sugar"",""1/2 cup canola oil, divided"",""1/2 pound boneless pork loin, cut into thin strips"",""2 bunches green onions, chopped"",""2 tablespoons soy sauce"",""2 teaspoons salt"",""4 eggs"",""8 large tomatoes, cut into chunks""]",162845,https://www.allrecipes.com/recipe/162845/chinese-tomato-and-egg/,Chinese Tomato and Egg Recipe - Allrecipes.com
0.00,chinese,0,"This is a popular dish in Singapore, usually found in hawker centers. The chicken stock makes the rice very fragrant and delicious. Serve with chile sauce and dark soy sauce.","[""1 whole chicken"",""2 3/4 cups white rice"",""2 pandan leaves"",""2 spring onions, cut into 2-inch pieces"",""2 teaspoons salt, divided"",""20 slices fresh ginger, divided"",""3 tablespoons sesame oil, divided"",""5 cloves garlic, crushed""]",247234,https://www.allrecipes.com/recipe/247234/homemade-hainanese-chicken-rice/,Homemade Hainanese Chicken Rice Recipe - Allrecipes.com
4.33,chinese,20,"These easy, spicy chicken wings are an excellent alternative to regular hot wings! I learned this recipe from my mother, who is from Taiwan, and it was always a childhood favorite! Almost all seasonings can be adjusted according to taste. (The Vietnamese chili garlic sauce can be found at any oriental grocery or even most regular groceries).","[""1 pound chicken wings"",""1 tablespoon sesame oil"",""1/2 cup soy sauce"",""1/4 cup rice wine"",""1/4 cup water"",""2 cloves garlic, minced"",""2 tablespoons white sugar"",""3 tablespoons chili garlic sauce""]",104600,https://www.allrecipes.com/recipe/104600/spicy-chinese-chicken-wings/,Spicy Chinese Chicken Wings Recipe - Allrecipes.com
5.00,chinese,1,"These Chinese cakes are filled with purple sweet potato, making them both gorgeous looking and tasting. Naturally sweet, glutinous rice flour is available in Asian markets and also many supermarkets. It makes a delicious pastry.","[""1 cup glutinous rice flour"",""1 pound purple sweet potatoes, peeled"",""1 tablespoon olive oil, or as needed"",""3 tablespoons lukewarm water, or more as needed""]",258158,https://www.allrecipes.com/recipe/258158/purple-sweet-potato-cakes/,Purple Sweet Potato Cakes Recipe - Allrecipes.com
4.53,chinese,759,This Egg Drop soup is born from a love of the soup and MANY trips to my favorite Chinese restaurant (asking them many questions) resulting in this variation. Compare it to your local restaurant...The simplicity is the key. Soup can be re-heated or frozen and re-heated.,"[""1 1/2 tablespoons cornstarch"",""1 egg yolk"",""1/4 teaspoon salt"",""1/8 teaspoon ground ginger"",""2 eggs"",""2 tablespoons chopped fresh chives"",""4 cups chicken broth, divided""]",45515,https://www.allrecipes.com/recipe/45515/restaurant-style-egg-drop-soup/,Restaurant Style Egg Drop Soup Recipe - Allrecipes.com
3.80,chinese,14,"Very delicious. I always make a little extra of the orange juice and Asian toasted sesame dressing on the side, just in case anyone wants extra. Serve over rice. I also like to make brown rice instead of white rice.","[""1 pound skinless, boneless chicken breast halves - cut into 1 1/2 inch pieces"",""1 red bell pepper, cut into 1 inch chunks"",""1 zucchini, cut into 1 inch chunks"",""1/4 cup orange juice"",""2 cups broccoli florets"",""2 green onions, cut into 1/2-inch pieces"",""2 tablespoons Asian-style toasted sesame salad dressing""]",205144,https://www.allrecipes.com/recipe/205144/orange-chicken-rice-bowl/,Orange-Chicken Rice Bowl Recipe - Allrecipes.com
5.00,chinese,3,"The dough for these addictive, delicate cookies (known as hua sheng bing in Mandarin) begins in the food processor, but you'll want to finish it by hand to keep it from becoming oily. For extra peanut flavor, use unrefined or semi-refined peanut oil, which smells and tastes nuttier. Cookies keep up to 3 days chilled in an airtight container, layers separated by waxed paper, or frozen up to 3 months.","[""1 1/4 cups confectioners' sugar"",""1 egg"",""1 tablespoon water"",""1 teaspoon salt"",""2 1/8 cups roasted unsalted peanuts"",""2 cups all-purpose flour"",""2 tablespoons all-purpose flour"",""2/3 cup peanut oil"",""3 tablespoons unsalted butter, melted"",""3/4 teaspoon baking powder"",""54 peanuts""]",262312,https://www.allrecipes.com/recipe/262312/lunar-new-year-peanut-cookies/,Lunar New Year Peanut Cookies Recipe - Allrecipes.com
4.75,chinese,850,"A genuinely mouthwatering dish with an Asian kick that will knock your chopsticks off! Don't be fooled by other General Tsao impostors: this is simply the best Chinese chicken you will ever have. With a flair of peanut oil, a streak of sesame, a dash of orange, and a sweet spot for hot, this is sure to be a favorite. Just don't forget to deep-fry twice! Serve with steamed broccoli and white rice.","[""1 1/2 pounds boneless, skinless chicken thighs, cut into 1/2 inch cubes"",""1 clove garlic, minced"",""1 cup cornstarch"",""1 egg"",""1 pinch white pepper"",""1 strip orange zest"",""1 tablespoon rice vinegar"",""1 teaspoon salt"",""1 teaspoon white sugar"",""1/2 cup white sugar"",""1/4 cup soy sauce"",""1/4 cup water"",""1/4 teaspoon ground ginger"",""2 tablespoons peanut oil"",""2 tablespoons vegetable oil"",""2 teaspoons cornstarch"",""2 teaspoons sesame oil"",""3 tablespoons chicken broth"",""3 tablespoons chopped green onion"",""4 cups vegetable oil for frying"",""6 dried whole red chilies""]",91499,https://www.allrecipes.com/recipe/91499/general-tsaos-chicken-ii/,General Tsao's Chicken II Recipe - Allrecipes.com
4.29,chinese,6,Super easy version of a delicious dish. Serve over coconut rice.,"[""1 carrot, grated"",""1 tablespoon grated fresh ginger"",""1 tablespoon sesame oil"",""1 teaspoon minced garlic"",""2 cups shredded napa cabbage"",""2 tablespoons soy sauce"",""2 tablespoons vegetable oil"",""3/4 pound pork tenderloin, fat trimmed and pork cut into 1/4-inch strips"",""salt and ground black pepper to taste""]",258246,https://www.allrecipes.com/recipe/258246/easy-moo-shu-pork/,Easy Moo Shu Pork Recipe - Allrecipes.com
4.22,chinese,79,"Marinated in a sherry honey glaze, then roasted to perfection, this dish will have you 'pigging out' to your heart's content!","[""1 tablespoon cornstarch"",""1 tablespoon water"",""1/2 cup dry sherry"",""1/2 teaspoon ground ginger"",""1/3 cup honey"",""2 cloves garlic, minced"",""3/4 cup soy sauce"",""4 pounds bone-in pork roast""]",14769,https://www.allrecipes.com/recipe/14769/chinese-roast-pork/,Chinese Roast Pork Recipe - Allrecipes.com
4.00,chinese,6,Shui Zhu Yu is one of the most common Sichuan fish dishes. 'Shui Zhu' is also one of the most famous Sichuan cooking styles. Its essential ingredient is Sichuan bean sauce. 'Shui' means water. 'Zhu' means boil. You might have also heard about 'Shui Zhu Niu Rou' which uses beef in place of fish. You may use 2 cups of soy bean sprouts to substitute for the celery and Napa cabbage stem. Cod is also a good substitute for basa. Enjoy the fish and I wish you 'Nian Nian You Yu'--Happy New Year!,"[""1 (6 ounce) fillet swai fish, cut into bite-sized pieces"",""1 cup sliced napa cabbage"",""1 egg white, beaten"",""1 tablespoon vegetable oil"",""1/2 teaspoon cornstarch"",""1/4 teaspoon ground white pepper"",""10 Sichuan peppercorns"",""2 cups water"",""2 sprigs cilantro"",""2 teaspoons Sichuan bean sauce"",""2 teaspoons minced garlic"",""3 stalks celery, cut into 1/2-inch pieces"",""3 thin slices fresh ginger root"",""5 dried chile de arbol peppers""]",213335,https://www.allrecipes.com/recipe/213335/shui-zhu-yu-sichuan-boiled-fish/,Shui Zhu Yu (Sichuan Boiled Fish) Recipe - Allrecipes.com
0.00,chinese,0,An Asian snack that is particularly popular in Hong Kong. Usually consisting of two types of dough to make a flaky pastry. A popular tea time treat for my family!,"[""1 1/2 cups sweet rice flour (mochiko)"",""1 cup candied waxgourd"",""1 egg yolk, beaten"",""1/2 cup vegetable shortening"",""1/2 cup water"",""1/4 cup butter"",""1/4 cup sesame seeds, toasted"",""1/4 cup vegetable shortening"",""2 cups cake flour"",""2 tablespoons confectioners' sugar"",""2/3 cup confectioners' sugar"",""2/3 cup water"",""3/4 cup superfine sugar""]",176531,https://www.allrecipes.com/recipe/176531/wife-pastry-lo-po-bang/,Wife Pastry (Lo Po Bang) Recipe - Allrecipes.com
4.00,chinese,1,"Congee, a Chinese rice porridge, will make any cold winter's day warm and welcoming. This recipe, also known as 'jook', was inspired by my Grandmother's frequent preparation of this dish. You will enjoy congee's unique velvety and savory taste.","[""1 cup white rice"",""1 tablespoon grated fresh ginger"",""1 teaspoon salt"",""1/2 teaspoon soy sauce, or to taste"",""1/2 teaspoon vinegar, or to taste"",""1/4 cup apple cider vinegar"",""1/4 cup pickled Chinese vegetables"",""1/4 cup sliced Chinese roast pork"",""1/4 teaspoon sesame oil"",""2 (6 ounce) fillets lean white fish, sliced"",""2 tablespoons chopped scallions"",""2 tablespoons crushed peanuts"",""2 tablespoons fish sauce"",""5 cups chicken stock"",""5 cups water""]",258062,https://www.allrecipes.com/recipe/258062/congee/,Congee Recipe - Allrecipes.com
4.29,chinese,5,"This chicken dish is straight from the Szechuan province of China and it is hot! It is known in China as Chong Qing Lazi Ji. Unfortunately, substituting black peppercorns for Szechuan will not taste right.","[""1 tablespoon minced fresh ginger root"",""1 teaspoon Chinese cooking wine"",""1/2 pound boneless chicken, cut into 1/2 inch cubes"",""1/2 teaspoon salt"",""1/2 teaspoon white sugar"",""1/4 cup cornstarch, or as needed"",""2 cups dried chilies, chopped"",""2 green onions, julienned"",""2 long, green chilies - cut into 1/2-inch pieces"",""2 tablespoons Szechuan peppercorns"",""2 teaspoons Chinese cooking wine"",""2 teaspoons soy sauce"",""3 cups peanut oil for frying"",""4 cloves garlic, minced""]",92739,https://www.allrecipes.com/recipe/92739/fiery-pepper-chicken/,Fiery Pepper Chicken Recipe - Allrecipes.com
4.25,chinese,7,"This is a baked version of the Chinese Gau, a dessert that is usually steamed and served for Chinese New Years.","[""1 (13.5 ounce) can coconut milk"",""1 (16 ounce) box sweet rice flour (mochiko)"",""1 teaspoon baking soda"",""2 cups brown sugar"",""2 cups milk"",""2 tablespoons sesame seeds"",""2 teaspoons vanilla extract"",""3/4 cup white sugar""]",109903,https://www.allrecipes.com/recipe/109903/crispy-baked-gau/,Crispy Baked Gau Recipe - Allrecipes.com
4.00,chinese,1,"These delicate little Chinese steamed buns are from the Shanghai region. Filled with minced chicken or pork, ginger, and spring onion. Feel free to experiment by including your favorite ingredients. Serve with shredded ginger in dark vinegar.","[""1 3/4 cups all-purpose flour"",""1 piece fresh ginger root, peeled"",""1 spring onion, sliced"",""1 tablespoon vegetable oil"",""1 teaspoon agar-agar flakes"",""1 teaspoon sesame oil"",""1/2 teaspoon freshly ground black pepper"",""1/2 teaspoon white sugar"",""2 tablespoons soy sauce"",""2 teaspoons cooking wine"",""2/3 cup warm water"",""3/4 cup chicken stock, or more if needed"",""3/4 cup warm water"",""9 ounces ground chicken"",""Dough:"",""Filling:""]",257935,https://www.allrecipes.com/recipe/257935/chinese-chicken-and-ginger-steamed-soup-dumplings/,Chinese Chicken and Ginger Steamed Soup Dumplings Recipe - Allrecipes.com
4.17,chinese,110,"This fast EASY one-skillet recipe utilizes only a few basic scary-sounding ingredients, but yields the most delicious spicy Mandarin/Szechuan flavor you ever tasted!  Serve over white rice. WARNING: Only for the brave and daring of tongue!  I give you 'Chicken Vicious'!!!","[""1 (8 ounce) package button mushrooms, sliced"",""1 1/2 cups distilled white vinegar"",""1 cup frozen green peas"",""1 cup white sugar"",""1 tablespoon onion powder, or to taste"",""1 tablespoon red pepper flakes, or to taste"",""1/2 cup soy sauce"",""1/2 teaspoon ground ginger"",""2 tablespoons cold water"",""2 tablespoons garlic powder, or to taste"",""2 teaspoons vegetable oil"",""3 green onions, chopped"",""3 teaspoons cornstarch"",""4 skinless, boneless chicken breast halves - cut into 1 inch pieces""]",51039,https://www.allrecipes.com/recipe/51039/chicken-vicious/,Chicken Vicious Recipe - Allrecipes.com
4.67,chinese,3,"Chicken marinated with Chinese classic ingredients, then dredged and fried for something divine.","[""1/2 cup sweet rice flour (mochiko)"",""1/4 cup cornstarch"",""1/4 cup oyster sauce"",""1/4 cup white sugar"",""2 cups vegetable oil, for deep frying"",""4 eggs"",""4 green onions, chopped"",""4 teaspoons salt"",""5 cloves garlic, minced"",""5 pounds boneless chicken thighs, cut in half""]",169582,https://www.allrecipes.com/recipe/169582/mochiko-asian-fried-chicken/,Mochiko Asian Fried Chicken Recipe - Allrecipes.com
3.14,chinese,6,A refreshing mango drink with a twist to it.,"[""1 mango - peeled, seeded and diced"",""1/2 cup coconut milk"",""1/2 cup small pearl tapioca"",""14 ice cubes""]",203328,https://www.allrecipes.com/recipe/203328/hong-kong-mango-drink/,Hong Kong Mango Drink Recipe - Allrecipes.com
4.30,chinese,59,"A recipe making egg foo young patties and a delicious sauce to put on top. This is a very special recipe acquired when I worked at a Chinese restaurant to pay for my red '66 VW bug when in high school! The recipe card is tattered and spotted now, but the dish is the best egg foo young I have ever had. Hope you enjoy it too! To serve, place egg patty over steamed rice and put the sauce on top.","[""1 cup cooked small shrimp"",""1/3 cup thinly sliced green onions"",""1/4 teaspoon garlic powder"",""2 tablespoons cornstarch"",""2 tablespoons distilled white vinegar"",""2 tablespoons soy sauce"",""2 tablespoons sugar"",""2 tablespoons vegetable oil"",""3 cups chicken broth"",""4 eggs"",""8 ounces fresh bean sprouts""]",163370,https://www.allrecipes.com/recipe/163370/shrimp-egg-foo-young/,Shrimp Egg Foo Young Recipe - Allrecipes.com
4.46,chinese,77,"A delicious and easy to prepare marinade consisting of ingredients that can be easily found at a Chinese grocery store. Don't let the ingredients fool you, this is a meal that even the less adventurous will enjoy.","[""1 1/2 teaspoons minced fresh ginger root"",""1 1/2 teaspoons packed brown sugar"",""1 clove garlic"",""1 pinch Chinese five-spice powder"",""1 tablespoon black bean sauce"",""1 tablespoon sherry"",""1/2 teaspoon sesame oil"",""2 (1 1/2 pound) pork tenderloins, trimmed"",""2 tablespoons hoisin sauce"",""2 tablespoons light soy sauce""]",53935,https://www.allrecipes.com/recipe/53935/chinese-pork-tenderloin/,Chinese Pork Tenderloin Recipe - Allrecipes.com
